topic,statements,answers
"Hiện tượng “Cừu ăn thịt người” là câu nói của Tô-mát Mo-rơ miêu tả thảm cảnh của người nông dân Anh trong phong trào “rào đất cướp ruộng” cuối thế kỉ XV đầu thế kỉ XVI. Quý tộc mới (quý tộc tư sản hóa) đã đuổi nông dân ra khỏi những mảnh đất mà họ đã từng canh tác để biến thành đồng cỏ nuôi cừu, kinh doanh thu lợi nhuận, tạo ra sự tích lũy tư bản nguyên thủy. Cuối thế kỉ XV – đầu thế kỉ XVI, phương thức sản xuất tư bản chủ nghĩa đã thâm nhập mạnh vào nông nghiệp Anh. Nguyên nhân chủ yếu dẫn đến phong trào “rào đất cướp ruộng” ở Anh là do sự phát triển mạnh mẽ của ngành công nghiệp len dạ. Sự phát triển của kinh tế tư bản chủ nghĩa trong nông nghiệp làm xuất hiện tầng lớp quý tộc mới, sau này đã liên minh với tư sản chống lại chế độ phong kiến Anh. Phong trào “rào đất cướp ruộng” đã góp phần cải thiện đời sống của nông dân Anh trước cách mạng tư sản.","Hiện tượng “Cừu ăn thịt người” miêu tả thảm cảnh của người nông dân Anh trong phong trào “rào đất cướp ruộng”;Cuối thế kỉ XV – đầu thế kỉ XVI, phương thức sản xuất tư bản chủ nghĩa đã thâm nhập mạnh vào nông nghiệp Anh;Nguyên nhân chủ yếu của phong trào “rào đất cướp ruộng” là do sự phát triển mạnh của ngành công nghiệp len dạ;Phong trào “rào đất cướp ruộng” đã góp phần cải thiện đời sống của nông dân Anh trước cách mạng tư sản.","1;1;1;0"
"Trong bối cảnh khoa học công nghệ phát triển mạnh, những vấn đề an ninh phi truyền thống đang đặt ra nhiều thách thức cho mọi quốc gia dân tộc. Đặc biệt, vấn đề an ninh con người (an ninh lương thực, an ninh y tế, an ninh môi trường, an ninh cá nhân,…) cần sự chung tay của nhiều quốc gia liên quan. Đại dịch Covid-19 đã gây ra cuộc khủng hoảng nhiều mặt, cả về y tế, xã hội lẫn chính trị, kinh tế, đặt các quốc gia tư bản trước nhiều biến động, khó khăn.","Đoạn tư liệu cho thấy thách thức của chủ nghĩa tư bản hiện đại;Đại dịch Covid-19 đã gây ra nhiều khó khăn cho nền kinh tế thế giới;Vấn đề an ninh con người chỉ cần sự chung tay của các cường quốc;Chỉ có các quốc gia tư bản gặp khó khăn trước Đại dịch Covid-19.","1;1;0;0"
"Đến năm 1922, nước Nga Xô viết và các nước cộng hòa Xô viết đồng minh có sự phát triển không đồng đều về kinh tế, văn hóa, chính trị. Trong khi Nga là nước có nền kinh tế công nghiệp tương đối phát triển (nhờ thực hiện chính sách Kinh tế mới), các nước khác vẫn trong tình trạng nông nghiệp lạc hậu. Các nước cộng hòa Xô viết cũng chưa có sự thống nhất về các chính sách phát triển kinh tế, văn hóa, giáo dục,… Điều đó đặt ra yêu cầu phải hợp tác, giúp đỡ lẫn nhau để cùng phát triển.","Liên bang Cộng hòa xã hội chủ nghĩa Xô viết được thành lập năm 1922 trong bối cảnh kinh tế nước Nga và các nước Xô viết khác có sự phát triển tương đối đồng đều;Một trong những nguyên nhân thúc đẩy sự thành lập Liên bang Cộng hòa xã hội chủ nghĩa Xô viết là do nhu cầu hợp tác, giúp đỡ nhau để cùng phát triển;Trước khi thành lập Liên bang Xô viết, các nước cộng hòa Xô viết đã có sự thống nhất bước đầu về các chính sách phát triển;Năm 1922, kinh tế nước Nga phát triển là do thực hiện chính sách Kinh tế mới do Lê-nin đề xướng.","0;1;0;1"
"Trước khi Chiến tranh thế giới thứ hai bùng nổ, trong những năm 1920-1939, nhân dân các dân tộc Đông Nam Á tiếp tục cuộc đấu tranh chống chính sách cai trị, bóc lột thuộc địa của các nước thực dân phương Tây với hai hình thức cải cách ôn hòa và bạo lực vũ trang. Từ năm 1930, nhiều đảng cộng sản được thành lập (Việt Nam, Ma-lai-xi-a, Xiêm, Phi-líp-pin) để lãnh đạo phong trào đấu tranh. Khi quân phiệt Nhật mở rộng chiến tranh, lần lượt chiếm đóng các nước Đông Nam Á (1940 - 1945), cuộc đấu tranh chuyển sang chống xâm lược và cai trị của quân phiệt Nhật. Tháng 8 - 1945, chớp thời cơ Nhật Bản đầu hàng Đồng minh, nhân dân In-đô-nê-xi-a, Lào, Việt Nam đã vùng lên đánh đuổi quân phiệt Nhật, giải phóng dân tộc, giành độc lập tự do cho đất nước.","Quá trình đấu tranh giành độc lập dân tộc ở Đông Nam Á từ năm 1920-1945 chống các nước thực dân phương Tây với hai hình thức cải cách ôn hòa và bạo lực vũ trang;Mục tiêu hàng đầu trong cuộc đấu tranh của các nước Đông Nam Á trong giai đoạn 1940-1945 là cải cách để phát triển đất nước;Đặc điểm quá trình xâm lược của các nước đế quốc ở khu vực Đông Nam Á là các nước chỉ thực hiện xâm lược bằng kinh tế;Năm 1945, Cách mạng tháng Tám thành công đã mang lại quyền tự trị cho đất nước Việt Nam.","1;0;0;0"
"Điểm chung của chính sách thống trị thực dân ở Đông Nam Á là khai thác, vơ vét và bòn rút các quốc gia trong khu vực bằng chính sách thuế khóa đánh vào các tầng lớp nhân dân bản địa, cướp ruộng đất lập đồn điền, bóc lột sức người, khai thác tài nguyên; thông qua khai thác triệt để sản phẩm nông nghiệp, tiếp tục đầu tư để bóc lột lâu dài trong công nghiệp... Vì vậy, cao su, cà phê, chè, lúa gạo là những sản vật đặc trưng của Đông Nam Á được thực dân phương Tây chú ý khai thác từ sớm.","Đoạn trích cung cấp thông tin về chính sách khai thác, bóc lột của thực dân phương Tây đối với khu vực Đông Nam Á;Trong công nghiệp, thực dân phương Tây tìm cách vơ vét, bòn rút các nước Đông Nam Á thông qua việc cướp ruộng đất lập đồn điền;Những sản vật được coi là thế mạnh của các nước Đông Nam Á được thực dân phương Tây chú ý đầu tư khai thác sớm để thu lợi nhuận cao;Khai thác tài nguyên thiên nhiên không phải là điểm chung trong chính sách cai trị của thực dân phương Tây ở Đông Nam Á.","1;0;1;0"
"“Vì vua tôi đồng tâm, anh em hòa mục, cả nước nhà góp sức, giặc phải bị bắt...., nó cậy trường trận, ta dựa vào đoản binh. Dùng đoản (binh) chế trường (trận) là sự thường của binh pháp. Nếu chỉ thấy quân nó kéo đến như lửa, như gió thì thế dễ chế ngự. Nếu nó tiến chậm như cách tằm ăn, không cầu thắng chóng, thì phải chọn dùng tướng giỏi, xem xét quyền biến, như đánh cờ vây, tùy thời tạo thế, có một đội quân một lòng như cha con thì mới dùng được. Vả lại, khoan thư sức dân để làm kế sâu rễ bền gốc, đó là thượng sách giữ nước vậy.”","Một trong những nguyên nhân dẫn đến sự thắng lợi trong cuộc đấu tranh bảo vệ tổ quốc là sự đoàn kết toàn dân, trên dưới đồng lòng quyết tâm chống giặc cứu nước;Thắng lợi mọi kẻ thù xâm lược là nhờ sự lựa chọn các tướng chỉ huy giỏi, có cách đánh và nghệ thuật quân sự sáng tạo, tạo thế đánh nhanh thắng nhanh;Nhân tố quyết định dẫn đến sự thắng lợi của các cuộc đấu tranh bảo vệ tổ quốc là truyền thống yêu nước và ý chí kiên cường bất khuất trong đấu tranh bảo vệ độc lập;Đấu tranh bảo vệ tổ quốc là nhiệm vụ bắt buộc tất cả toàn dân tham gia đánh giặc, thời thế tạo anh hùng, tận dụng lợi thế địa hình sông, núi tạo thế lợi cho ta để đánh bại kẻ thù.","1;0;1;1"
